{
  "operation_id": "12121212121212121212121212121212",
  "task_id": "task.one",
  "module": "host",
  "verb": "status",
  "target": "system",
  "plan_digest": "abababababababababababababababababababababababababababababababab",
  "mode": "product-up",
  "surface": "cli",
  "actor": "user-1",
  "state": "running",
  "outcome": "unknown",
  "log_ref": "journal:OLIVARES_OPERATION_ID=12121212121212121212121212121212"
}
